{
  "AccountId":          "641079926471",
  "Environment":        "dev",
  "VpcCidr":            "10.0.0.0/16",
  "VpcName":            "dev-vpc",
  "PublicSubnetACidr":  "10.0.1.0/24",
  "PublicSubnetBCidr":  "10.0.2.0/24",
  "PrivateSubnetACidr": "10.0.10.0/24",
  "PrivateSubnetBCidr": "10.0.11.0/24"
}
